
================== ASTRAL ===================== 

This is ASTRAL version 4.10.8
Gene trees are treated as unrooted
1000 trees read from model.200.2000000.0.000001/32/estimatedgenetre.halfresolved
All outputted trees will be *arbitrarily* rooted at 70

======== Running the main analysis
Number of taxa: 201 (201 species)
Taxa: [70, 27, 73, 120, 125, 189, 101, 113, 168, 90, 36, 163, 37, 20, 84, 122, 83, 144, 31, 152, 130, 82, 78, 184, 28, 66, 18, 121, 104, 22, 107, 148, 126, 61, 174, 19, 67, 92, 132, 15, 24, 3, 102, 96, 196, 87, 199, 127, 51, 6, 185, 76, 111, 108, 57, 119, 43, 39, 160, 4, 30, 198, 138, 99, 12, 153, 112, 98, 134, 190, 42, 46, 94, 75, 142, 135, 97, 41, 47, 2, 80, 186, 35, 64, 194, 173, 151, 50, 180, 187, 69, 200, 178, 38, 183, 14, 123, 197, 116, 128, 103, 68, 60, 139, 17, 118, 176, 192, 172, 1, 140, 165, 91, 85, 48, 7, 146, 137, 141, 13, 59, 86, 177, 63, 21, 117, 11, 25, 162, 181, 62, 133, 159, 49, 53, 164, 145, 155, 74, 100, 34, 16, 106, 179, 195, 33, 156, 166, 26, 131, 10, 147, 8, 32, 171, 77, 167, 114, 45, 169, 23, 81, 89, 157, 158, 115, 54, 65, 88, 149, 109, 143, 191, 170, 161, 5, 56, 40, 44, 72, 9, 175, 71, 124, 58, 105, 79, 93, 188, 55, 110, 0, 182, 129, 136, 29, 95, 193, 154, 150, 52]
Taxon occupancy: {35=1000, 36=1000, 159=1000, 33=1000, 34=1000, 158=1000, 39=1000, 157=1000, 156=1000, 37=1000, 155=1000, 154=1000, 38=1000, 152=1000, 153=1000, 150=1000, 151=1000, 43=1000, 42=1000, 41=1000, 40=1000, 200=1000, 22=1000, 169=1000, 23=1000, 24=1000, 25=1000, 166=1000, 26=1000, 27=1000, 165=1000, 168=1000, 28=1000, 29=1000, 167=1000, 3=1000, 161=1000, 2=1000, 162=1000, 163=1000, 1=1000, 164=1000, 0=1000, 30=1000, 7=1000, 6=1000, 32=1000, 5=1000, 4=1000, 160=1000, 31=1000, 9=1000, 8=1000, 19=1000, 17=1000, 179=1000, 178=1000, 18=1000, 15=1000, 177=1000, 176=1000, 16=1000, 13=1000, 14=1000, 11=1000, 12=1000, 21=1000, 170=1000, 20=1000, 171=1000, 174=1000, 175=1000, 172=1000, 173=1000, 188=1000, 187=1000, 189=1000, 180=1000, 181=1000, 10=1000, 182=1000, 183=1000, 184=1000, 185=1000, 186=1000, 116=1000, 117=1000, 79=1000, 78=1000, 114=1000, 77=1000, 115=1000, 112=1000, 113=1000, 110=1000, 111=1000, 118=1000, 119=1000, 82=1000, 83=1000, 80=1000, 81=1000, 86=1000, 87=1000, 84=1000, 85=1000, 125=1000, 67=1000, 66=1000, 126=1000, 69=1000, 127=1000, 128=1000, 68=1000, 121=1000, 122=1000, 123=1000, 124=1000, 129=1000, 70=1000, 120=1000, 71=1000, 72=1000, 73=1000, 74=1000, 75=1000, 76=1000, 134=1000, 135=1000, 132=1000, 59=1000, 133=1000, 138=1000, 58=1000, 57=1000, 139=1000, 136=1000, 56=1000, 137=1000, 55=1000, 64=1000, 65=1000, 62=1000, 63=1000, 60=1000, 131=1000, 130=1000, 61=1000, 49=1000, 143=1000, 144=1000, 48=1000, 145=1000, 146=1000, 147=1000, 45=1000, 148=1000, 44=1000, 47=1000, 149=1000, 46=1000, 51=1000, 52=1000, 53=1000, 54=1000, 140=1000, 142=1000, 50=1000, 141=1000, 109=1000, 108=1000, 107=1000, 106=1000, 105=1000, 104=1000, 103=1000, 99=1000, 102=1000, 101=1000, 100=1000, 98=1000, 97=1000, 96=1000, 95=1000, 94=1000, 93=1000, 92=1000, 91=1000, 90=1000, 88=1000, 89=1000, 195=1000, 194=1000, 197=1000, 196=1000, 191=1000, 190=1000, 193=1000, 192=1000, 198=1000, 199=1000}
Number of gene trees: 1000
0 trees have missing taxa
Calculating quartet distance matrix (for completion of X)
Species tree distances calculated ...
Building set of clusters (X) from gene trees 
Using tree-based weight calculation.
Number of Default Clusters: 36217
Number of quartet trees in the gene trees: 65998339728
calculating extra bipartitions to be added at level 1 ...
Number of Clusters after addition by distance: 36217
Adding to X using resolutions of greedy consensus ...
Threshold 0.0:
Threshold 0.01:
Threshold 0.02:
Threshold 0.05:
Threshold 0.1:
polytomy of size 4; rounds with additions with at least 0.01 support: 0; clusters: 36217
Threshold 0.2:
polytomy of size 3; rounds with additions with at least 0.01 support: 0; clusters: 36217
polytomy of size 3; rounds with additions with at least 0.01 support: 0; clusters: 36217
polytomy of size 4; rounds with additions with at least 0.01 support: 0; clusters: 36217
polytomy of size 3; rounds with additions with at least 0.01 support: 0; clusters: 36217
polytomy of size 5; rounds with additions with at least 0.01 support: 0; clusters: 36217
polytomy of size 3; rounds with additions with at least 0.01 support: 0; clusters: 36217
polytomy of size 3; rounds with additions with at least 0.01 support: 0; clusters: 36217
polytomy of size 7; rounds with additions with at least 0.01 support: 0; clusters: 36217
polytomy of size 3; rounds with additions with at least 0.01 support: 0; clusters: 36217
Threshold 0.3333333333333333:
polytomy of size 3; rounds with additions with at least 0.01 support: 0; clusters: 36217
polytomy of size 3; rounds with additions with at least 0.01 support: 0; clusters: 36217
polytomy of size 3; rounds with additions with at least 0.01 support: 0; clusters: 36217
polytomy of size 3; rounds with additions with at least 0.01 support: 0; clusters: 36217
polytomy of size 3; rounds with additions with at least 0.01 support: 0; clusters: 36217
polytomy of size 6; rounds with additions with at least 0.01 support: 0; clusters: 36217
polytomy of size 4; rounds with additions with at least 0.01 support: 0; clusters: 36217
polytomy of size 4; rounds with additions with at least 0.01 support: 0; clusters: 36217
polytomy of size 3; rounds with additions with at least 0.01 support: 0; clusters: 36217
polytomy of size 3; rounds with additions with at least 0.01 support: 0; clusters: 36217
polytomy of size 7; rounds with additions with at least 0.01 support: 0; clusters: 36217
polytomy of size 4; rounds with additions with at least 0.01 support: 0; clusters: 36217
polytomy of size 4; rounds with additions with at least 0.01 support: 0; clusters: 36217
polytomy of size 4; rounds with additions with at least 0.01 support: 0; clusters: 36217
polytomy of size 5; rounds with additions with at least 0.01 support: 0; clusters: 36217
polytomy of size 7; rounds with additions with at least 0.01 support: 0; clusters: 36217
polytomy of size 11; rounds with additions with at least 0.01 support: 0; clusters: 36233
polytomy of size 4; rounds with additions with at least 0.01 support: 0; clusters: 36233
polytomy of size 4; rounds with additions with at least 0.01 support: 0; clusters: 36233
Number of Clusters after addition by greedy: 36233
partitions formed in 21.112 secs
Dynamic Programming starting after 21.112 secs
Size of largest cluster: 201
Size of largest cluster: 201
Total Number of elements weighted: 171153
Normalized score (portion of input quartet trees satisfied): NaN
Final optimization score: 0
Calculated 100000 weights; time (seconds): 43
Total Number of elements weighted: 171153
Normalized score (portion of input quartet trees satisfied): 0.8302803715947441
Final optimization score: 54797126034
Optimal tree inferred in 68.05 secs.
(70,(27,((51,(6,(185,(76,111)))),(((12,(99,(153,112))),((30,(198,138)),((98,(108,57)),((43,4),(39,(119,160)))))),((((85,48),(140,(165,91))),((97,41),(47,(2,80)))),((((186,35),((64,194),((173,151),(50,180)))),(((183,(14,123)),(197,(103,(128,(116,(68,60)))))),((200,(178,38)),((187,69),(139,((17,118),((192,1),(176,172)))))))),(((134,(190,42)),(75,((46,94),(142,135)))),(((102,(87,(196,(199,(96,127))))),(29,((73,((101,(113,168)),(120,(125,189)))),(67,(((82,78),(152,(130,(184,(31,(83,144)))))),((84,122),((((36,163),(90,(37,20))),((92,132),(15,(24,3)))),((61,(174,19)),((66,18),(28,(126,((104,22),(148,(121,107)))))))))))))),(0,(((129,(182,136)),(149,(109,143))),(((154,(150,52)),(((161,(191,170)),((40,44),(5,56))),((72,((105,79),(93,(124,58)))),((71,(9,175)),(110,(188,55)))))),(((59,(86,(177,63))),((11,25),((21,((7,13),(146,(137,141)))),((117,(95,193)),((169,(23,81)),(45,(65,((88,(115,54)),(89,(157,158)))))))))),((167,((8,32),((171,77),(147,114)))),(((131,10),(156,((166,26),(33,((179,195),(16,106)))))),((162,181),(155,(74,((100,34),(62,(145,((133,49),(159,(53,164)))))))))))))))))))))));
Quartet score is: 54797126034
Normalized quartet score is: 0.8302803715947441
ASTRAL finished in 77.695 secs
